{
  "agent_id": "Agent-5",
  "specialty": "Integration & Tooling",
  "coordinates": [652, 421],
  "status": "active",
  "current_mission": {
    "mission_id": "V3.1_UNIFIED_FEEDBACK_LOOP_ROLLOUT",
    "title": "V3.1 Unified Feedback Loop Rollout",
    "priority": "HIGH",
    "status": "completed",
    "progress": 100,
    "objectives": [
      {
        "objective_id": "v31_swarm_contract",
        "description": "Deploy contracts/swarm_contract.yaml as the new SSOT",
        "status": "completed"
      },
      {
        "objective_id": "v31_devlog_template",
        "description": "Implement templates/DEVLOG_TEMPLATE.md for standardized devlogs",
        "status": "completed"
      },
      {
        "objective_id": "v31_status_schema",
        "description": "Deploy schemas/status.schema.json for cycle validation",
        "status": "completed"
      },
      {
        "objective_id": "v31_dup_scan",
        "description": "Create scripts/dup_scan.py for duplication prevention",
        "status": "completed"
      },
      {
        "objective_id": "v31_agent_cycle",
        "description": "Deploy scripts/agent_cycle.py for unified cycle automation",
        "status": "completed"
      }
    ]
  },
  "cycle_info": {
    "cycle_number": 1,
    "start_time": "2025-01-10T13:49:31.956691",
    "duration": "24_hours",
    "end_time": "2025-01-10T13:55:00.000000"
  },
  "performance_metrics": {
    "tasks_completed": 5,
    "files_processed": 5,
    "coordination_score": 10,
    "quality_score": 10,
    "v2_compliance": true,
    "file_size_compliance": true
  },
  "communication": {
    "messages_sent": 1,
    "messages_received": 1,
    "inbox_status": {
      "unread_count": 0,
      "pending_responses": 0
    }
  },
  "deployment_status": {
    "components_deployed": [
      {
        "component_name": "swarm_contract.yaml",
        "status": "deployed",
        "deployment_time": "2025-01-10T13:50:00.000000"
      },
      {
        "component_name": "DEVLOG_TEMPLATE.md",
        "status": "deployed",
        "deployment_time": "2025-01-10T13:51:00.000000"
      },
      {
        "component_name": "status.schema.json",
        "status": "deployed",
        "deployment_time": "2025-01-10T13:52:00.000000"
      },
      {
        "component_name": "dup_scan.py",
        "status": "deployed",
        "deployment_time": "2025-01-10T13:53:00.000000"
      },
      {
        "component_name": "agent_cycle.py",
        "status": "deployed",
        "deployment_time": "2025-01-10T13:54:00.000000"
      }
    ],
    "integration_status": {
      "swarm_contract": "active",
      "feedback_loop": "active",
      "cycle_automation": "active"
    }
  },
  "issues": [],
  "next_cycle_plan": {
    "upcoming_tasks": [
      {
        "task_id": "swarm_adoption",
        "description": "Support swarm-wide adoption of V3.1 components",
        "priority": "HIGH"
      },
      {
        "task_id": "monitoring",
        "description": "Monitor unified feedback loop performance",
        "priority": "REGULAR"
      }
    ],
    "dependencies": [],
    "coordination_needs": ["Agent-4", "All swarm agents"]
  },
  "last_updated": "2025-01-10T13:55:00.000000",
  "version": "3.1"
}
